{
  "vectorsFormat": "lattice-minting-vectors/1",
  "description": "Generated by lattice_minting for EventOccurrenceRole of https://example.org/lending#Order (PositionDerivedEvent).",
  "recipe": {
    "epochWidth": 19,
    "iriTemplate": "urn:ev:{namespace}/e{epoch}/{seq}",
    "namespace": {
      "derivation": "HashedTargetDerivation",
      "digest": {
        "encoding": "lowercase-hex",
        "function": "SHA-256",
        "widthBits": 64
      }
    },
    "recipeDigest": "sha256:624294a5bd3a577a9d42f6980dae675dc7dfb5636b1651085da4b530dca5e260",
    "recipeFormat": "lattice-minting-recipe/1",
    "role": "EventOccurrenceRole",
    "sequenceWidth": 19,
    "strategy": "PositionDerivedEvent",
    "target": {
      "class": "https://example.org/lending#Order",
      "deployment": null
    }
  },
  "testSecrets": {},
  "positive": [
    {
      "id": "position-0",
      "category": "position",
      "inputs": {
        "target": "urn:g:orders/1",
        "epoch": 0,
        "seq": 0
      },
      "trace": [
        {
          "step": "tuple",
          "components": [
            "occurrence-namespace/1",
            "urn:g:orders/1"
          ],
          "hex": "32323a6f6363757272656e63652d6e616d6573706163652f3131343a75726e3a673a6f72646572732f31"
        },
        {
          "step": "digest",
          "function": "SHA-256",
          "hex": "ebd9dd1bf675bb71675b5ff9352ade51b2e27779c6de890bcaf6777fc0fe19b9"
        },
        {
          "step": "truncate",
          "widthBits": 64,
          "hex": "ebd9dd1bf675bb71"
        },
        {
          "step": "encode",
          "encoding": "lowercase-hex",
          "value": "ebd9dd1bf675bb71"
        },
        {
          "step": "pad",
          "epoch": "0000000000000000000",
          "seq": "0000000000000000000"
        },
        {
          "step": "render",
          "iri": "urn:ev:ebd9dd1bf675bb71/e0000000000000000000/0000000000000000000"
        }
      ],
      "iri": "urn:ev:ebd9dd1bf675bb71/e0000000000000000000/0000000000000000000"
    },
    {
      "id": "position-1",
      "category": "position",
      "inputs": {
        "target": "urn:g:orders/1",
        "epoch": 3,
        "seq": 42
      },
      "trace": [
        {
          "step": "tuple",
          "components": [
            "occurrence-namespace/1",
            "urn:g:orders/1"
          ],
          "hex": "32323a6f6363757272656e63652d6e616d6573706163652f3131343a75726e3a673a6f72646572732f31"
        },
        {
          "step": "digest",
          "function": "SHA-256",
          "hex": "ebd9dd1bf675bb71675b5ff9352ade51b2e27779c6de890bcaf6777fc0fe19b9"
        },
        {
          "step": "truncate",
          "widthBits": 64,
          "hex": "ebd9dd1bf675bb71"
        },
        {
          "step": "encode",
          "encoding": "lowercase-hex",
          "value": "ebd9dd1bf675bb71"
        },
        {
          "step": "pad",
          "epoch": "0000000000000000003",
          "seq": "0000000000000000042"
        },
        {
          "step": "render",
          "iri": "urn:ev:ebd9dd1bf675bb71/e0000000000000000003/0000000000000000042"
        }
      ],
      "iri": "urn:ev:ebd9dd1bf675bb71/e0000000000000000003/0000000000000000042"
    },
    {
      "id": "position-2",
      "category": "position",
      "inputs": {
        "target": "urn:g:orders/1",
        "epoch": 1,
        "seq": 1000000000000000000
      },
      "trace": [
        {
          "step": "tuple",
          "components": [
            "occurrence-namespace/1",
            "urn:g:orders/1"
          ],
          "hex": "32323a6f6363757272656e63652d6e616d6573706163652f3131343a75726e3a673a6f72646572732f31"
        },
        {
          "step": "digest",
          "function": "SHA-256",
          "hex": "ebd9dd1bf675bb71675b5ff9352ade51b2e27779c6de890bcaf6777fc0fe19b9"
        },
        {
          "step": "truncate",
          "widthBits": 64,
          "hex": "ebd9dd1bf675bb71"
        },
        {
          "step": "encode",
          "encoding": "lowercase-hex",
          "value": "ebd9dd1bf675bb71"
        },
        {
          "step": "pad",
          "epoch": "0000000000000000001",
          "seq": "1000000000000000000"
        },
        {
          "step": "render",
          "iri": "urn:ev:ebd9dd1bf675bb71/e0000000000000000001/1000000000000000000"
        }
      ],
      "iri": "urn:ev:ebd9dd1bf675bb71/e0000000000000000001/1000000000000000000"
    },
    {
      "id": "position-3",
      "category": "position",
      "inputs": {
        "target": "urn:g:orders/1",
        "epoch": 9223372036854775807,
        "seq": 9223372036854775807
      },
      "trace": [
        {
          "step": "tuple",
          "components": [
            "occurrence-namespace/1",
            "urn:g:orders/1"
          ],
          "hex": "32323a6f6363757272656e63652d6e616d6573706163652f3131343a75726e3a673a6f72646572732f31"
        },
        {
          "step": "digest",
          "function": "SHA-256",
          "hex": "ebd9dd1bf675bb71675b5ff9352ade51b2e27779c6de890bcaf6777fc0fe19b9"
        },
        {
          "step": "truncate",
          "widthBits": 64,
          "hex": "ebd9dd1bf675bb71"
        },
        {
          "step": "encode",
          "encoding": "lowercase-hex",
          "value": "ebd9dd1bf675bb71"
        },
        {
          "step": "pad",
          "epoch": "9223372036854775807",
          "seq": "9223372036854775807"
        },
        {
          "step": "render",
          "iri": "urn:ev:ebd9dd1bf675bb71/e9223372036854775807/9223372036854775807"
        }
      ],
      "iri": "urn:ev:ebd9dd1bf675bb71/e9223372036854775807/9223372036854775807"
    },
    {
      "id": "position-other-target",
      "category": "position",
      "inputs": {
        "target": "urn:g:orders/2",
        "epoch": 3,
        "seq": 42
      },
      "trace": [
        {
          "step": "tuple",
          "components": [
            "occurrence-namespace/1",
            "urn:g:orders/2"
          ],
          "hex": "32323a6f6363757272656e63652d6e616d6573706163652f3131343a75726e3a673a6f72646572732f32"
        },
        {
          "step": "digest",
          "function": "SHA-256",
          "hex": "9f2ef09d2b2dcd1b851950d3f62b9afd28fb244e217bd245ae635255e88c1712"
        },
        {
          "step": "truncate",
          "widthBits": 64,
          "hex": "9f2ef09d2b2dcd1b"
        },
        {
          "step": "encode",
          "encoding": "lowercase-hex",
          "value": "9f2ef09d2b2dcd1b"
        },
        {
          "step": "pad",
          "epoch": "0000000000000000003",
          "seq": "0000000000000000042"
        },
        {
          "step": "render",
          "iri": "urn:ev:9f2ef09d2b2dcd1b/e0000000000000000003/0000000000000000042"
        }
      ],
      "iri": "urn:ev:9f2ef09d2b2dcd1b/e0000000000000000003/0000000000000000042"
    },
    {
      "id": "position-non-ascii-target",
      "category": "position",
      "inputs": {
        "target": "urn:g:commandes/\u00e9t\u00e9",
        "epoch": 3,
        "seq": 42
      },
      "trace": [
        {
          "step": "tuple",
          "components": [
            "occurrence-namespace/1",
            "urn:g:commandes/\u00e9t\u00e9"
          ],
          "hex": "32323a6f6363757272656e63652d6e616d6573706163652f3132313a75726e3a673a636f6d6d616e6465732fc3a974c3a9"
        },
        {
          "step": "digest",
          "function": "SHA-256",
          "hex": "bbe077e610d3b20cf4c4e797f8833b08d14cb5043525adedd8467986f21cd645"
        },
        {
          "step": "truncate",
          "widthBits": 64,
          "hex": "bbe077e610d3b20c"
        },
        {
          "step": "encode",
          "encoding": "lowercase-hex",
          "value": "bbe077e610d3b20c"
        },
        {
          "step": "pad",
          "epoch": "0000000000000000003",
          "seq": "0000000000000000042"
        },
        {
          "step": "render",
          "iri": "urn:ev:bbe077e610d3b20c/e0000000000000000003/0000000000000000042"
        }
      ],
      "iri": "urn:ev:bbe077e610d3b20c/e0000000000000000003/0000000000000000042"
    }
  ],
  "negative": [
    {
      "id": "neg-negative-seq",
      "category": "range",
      "inputs": {
        "target": "urn:g:orders/1",
        "epoch": 3,
        "seq": -1
      },
      "error": "PositionOutOfRange"
    },
    {
      "id": "neg-seq-too-large",
      "category": "range",
      "inputs": {
        "target": "urn:g:orders/1",
        "epoch": 3,
        "seq": 9223372036854775808
      },
      "error": "PositionOutOfRange"
    },
    {
      "id": "neg-negative-epoch",
      "category": "range",
      "inputs": {
        "target": "urn:g:orders/1",
        "epoch": -1,
        "seq": 1
      },
      "error": "PositionOutOfRange"
    }
  ],
  "format": []
}
