{
  "vectorsFormat": "lattice-minting-vectors/1",
  "description": "Generated by lattice_minting for EntityRole of https://example.org/lending#Instrument (ExternalRegistryIdentity).",
  "recipe": {
    "acceptedPattern": "^urn:isin:[A-Z]{2}[A-Z0-9]{9}[0-9]$",
    "namingAuthority": "example instrument registry",
    "recipeDigest": "sha256:544122b2d6f88734f251f2701c6a3dc7f027a7c8bbc597bc3541dede55cd7972",
    "recipeFormat": "lattice-minting-recipe/1",
    "role": "EntityRole",
    "strategy": "ExternalRegistryIdentity",
    "target": {
      "class": "https://example.org/lending#Instrument",
      "deployment": null
    }
  },
  "testSecrets": {},
  "positive": [],
  "negative": [
    {
      "id": "neg-empty",
      "category": "pattern",
      "inputs": {
        "iri": ""
      },
      "error": "PatternMismatch"
    },
    {
      "id": "neg-missing",
      "category": "pattern",
      "inputs": {},
      "error": "PatternMismatch"
    }
  ],
  "format": []
}
