{
  "vectorsFormat": "lattice-minting-vectors/1",
  "description": "Generated by lattice_minting for ComponentRole of https://example.org/lending#LineItem (RandomSurrogateIdentity).",
  "recipe": {
    "iriTemplate": "urn:ex:line-item:{surrogate}",
    "recipeDigest": "sha256:ff544ac69b0b490d40cd5a01aeec8a34caf6864b8672c5168f05b0ea57bdec0a",
    "recipeFormat": "lattice-minting-recipe/1",
    "role": "ComponentRole",
    "strategy": "RandomSurrogateIdentity",
    "surrogate": {
      "kind": "UuidV4Surrogate"
    },
    "target": {
      "class": "https://example.org/lending#LineItem",
      "deployment": null
    }
  },
  "testSecrets": {},
  "positive": [
    {
      "id": "random-0",
      "category": "supplied-randomness",
      "inputs": {
        "randomHex": "00112233445566778899aabbccddeeff"
      },
      "trace": [
        {
          "step": "generate-surrogate",
          "randomHex": "00112233445566778899aabbccddeeff",
          "value": "00112233-4455-4677-8899-aabbccddeeff"
        },
        {
          "step": "render",
          "iri": "urn:ex:line-item:00112233-4455-4677-8899-aabbccddeeff"
        }
      ],
      "iri": "urn:ex:line-item:00112233-4455-4677-8899-aabbccddeeff"
    },
    {
      "id": "random-1",
      "category": "supplied-randomness",
      "inputs": {
        "randomHex": "ffffffffffffffffffffffffffffffff"
      },
      "trace": [
        {
          "step": "generate-surrogate",
          "randomHex": "ffffffffffffffffffffffffffffffff",
          "value": "ffffffff-ffff-4fff-bfff-ffffffffffff"
        },
        {
          "step": "render",
          "iri": "urn:ex:line-item:ffffffff-ffff-4fff-bfff-ffffffffffff"
        }
      ],
      "iri": "urn:ex:line-item:ffffffff-ffff-4fff-bfff-ffffffffffff"
    },
    {
      "id": "random-2",
      "category": "supplied-randomness",
      "inputs": {
        "randomHex": "0f1e2d3c4b5a69788796a5b4c3d2e1f0"
      },
      "trace": [
        {
          "step": "generate-surrogate",
          "randomHex": "0f1e2d3c4b5a69788796a5b4c3d2e1f0",
          "value": "0f1e2d3c-4b5a-4978-8796-a5b4c3d2e1f0"
        },
        {
          "step": "render",
          "iri": "urn:ex:line-item:0f1e2d3c-4b5a-4978-8796-a5b4c3d2e1f0"
        }
      ],
      "iri": "urn:ex:line-item:0f1e2d3c-4b5a-4978-8796-a5b4c3d2e1f0"
    }
  ],
  "negative": [],
  "format": [
    {
      "id": "surrogate-format",
      "pattern": "^urn:ex:line\\-item:[0-9a-f]{8}-[0-9a-f]{4}-4[0-9a-f]{3}-[89ab][0-9a-f]{3}-[0-9a-f]{12}$",
      "accept": [
        "urn:ex:line-item:2b6f9e34-9a41-4d7a-8b2e-3f6c1a9d7e40"
      ],
      "reject": [
        "urn:ex:line-item:2B6F9E34-9A41-4D7A-8B2E-3F6C1A9D7E40",
        "urn:ex:line-item:2b6f9e34-9a41-7d7a-8b2e-3f6c1a9d7e40"
      ]
    }
  ]
}
