{
  "vectorsFormat": "lattice-minting-vectors/1",
  "description": "Generated by lattice_minting for EventOccurrenceRole of https://example.org/lending#Shipment (PositionDerivedEvent).",
  "recipe": {
    "epochWidth": 4,
    "iriTemplate": "urn:ev:shipment:{namespace}:{epoch}:{seq}",
    "namespace": {
      "derivation": "RegistryTokenDerivation"
    },
    "recipeDigest": "sha256:c0d524d42dc606daf7ee89f00c6ec1787389f290c31413e29d7b6dad7cc9157c",
    "recipeFormat": "lattice-minting-recipe/1",
    "role": "EventOccurrenceRole",
    "sequenceWidth": 8,
    "strategy": "PositionDerivedEvent",
    "target": {
      "class": "https://example.org/lending#Shipment",
      "deployment": null
    }
  },
  "testSecrets": {},
  "positive": [
    {
      "id": "position-0",
      "category": "position",
      "inputs": {
        "namespaceToken": "orders-1",
        "epoch": 0,
        "seq": 0
      },
      "trace": [
        {
          "step": "validate-token",
          "pattern": "^[A-Za-z0-9._~-]+$",
          "value": "orders-1"
        },
        {
          "step": "pad",
          "epoch": "0000",
          "seq": "00000000"
        },
        {
          "step": "render",
          "iri": "urn:ev:shipment:orders-1:0000:00000000"
        }
      ],
      "iri": "urn:ev:shipment:orders-1:0000:00000000"
    },
    {
      "id": "position-1",
      "category": "position",
      "inputs": {
        "namespaceToken": "orders-1",
        "epoch": 3,
        "seq": 42
      },
      "trace": [
        {
          "step": "validate-token",
          "pattern": "^[A-Za-z0-9._~-]+$",
          "value": "orders-1"
        },
        {
          "step": "pad",
          "epoch": "0003",
          "seq": "00000042"
        },
        {
          "step": "render",
          "iri": "urn:ev:shipment:orders-1:0003:00000042"
        }
      ],
      "iri": "urn:ev:shipment:orders-1:0003:00000042"
    },
    {
      "id": "position-2",
      "category": "position",
      "inputs": {
        "namespaceToken": "orders-1",
        "epoch": 9999,
        "seq": 99999999
      },
      "trace": [
        {
          "step": "validate-token",
          "pattern": "^[A-Za-z0-9._~-]+$",
          "value": "orders-1"
        },
        {
          "step": "pad",
          "epoch": "9999",
          "seq": "99999999"
        },
        {
          "step": "render",
          "iri": "urn:ev:shipment:orders-1:9999:99999999"
        }
      ],
      "iri": "urn:ev:shipment:orders-1:9999:99999999"
    }
  ],
  "negative": [
    {
      "id": "neg-bad-token",
      "category": "pattern",
      "inputs": {
        "namespaceToken": "orders 1",
        "epoch": 3,
        "seq": 42
      },
      "error": "PatternMismatch"
    },
    {
      "id": "neg-dot-token",
      "category": "dot-segment",
      "inputs": {
        "namespaceToken": "..",
        "epoch": 3,
        "seq": 42
      },
      "error": "DotSegment"
    },
    {
      "id": "neg-negative-seq",
      "category": "range",
      "inputs": {
        "namespaceToken": "orders-1",
        "epoch": 3,
        "seq": -1
      },
      "error": "PositionOutOfRange"
    },
    {
      "id": "neg-seq-too-large",
      "category": "range",
      "inputs": {
        "namespaceToken": "orders-1",
        "epoch": 3,
        "seq": 9223372036854775808
      },
      "error": "PositionOutOfRange"
    },
    {
      "id": "neg-negative-epoch",
      "category": "range",
      "inputs": {
        "namespaceToken": "orders-1",
        "epoch": -1,
        "seq": 1
      },
      "error": "PositionOutOfRange"
    },
    {
      "id": "neg-epoch-exceeds-width",
      "category": "width",
      "inputs": {
        "namespaceToken": "orders-1",
        "epoch": 10000,
        "seq": 42
      },
      "error": "PositionWidthOverflow"
    },
    {
      "id": "neg-seq-exceeds-width",
      "category": "width",
      "inputs": {
        "namespaceToken": "orders-1",
        "epoch": 3,
        "seq": 100000000
      },
      "error": "PositionWidthOverflow"
    }
  ],
  "format": []
}
