{
  "vectorsFormat": "lattice-minting-vectors/1",
  "description": "Generated by lattice_minting for ContentRevisionRole of https://example.org/lending#Contract (ContentAddressedIdentity).",
  "recipe": {
    "callerObligations": [
      {
        "id": "CA-1",
        "text": "The bytes are the output of an RDFC-1.0 implementation that passes the W3C RDFC-1.0 test suite, serialized as canonical N-Quads in UTF-8, one line per quad, each terminated by a single LF, with no other bytes."
      },
      {
        "id": "CA-2",
        "text": "The recipe's self-reference rule is applied before canonicalization."
      },
      {
        "id": "CA-3",
        "text": "Canonicalization stops at the recipe's work budget and the graph is refused, never hashed on a best-effort basis."
      },
      {
        "id": "CA-4",
        "text": "Where verifyFullDigest is true, the full digest is stored and compared on every re-registration of the identifier."
      }
    ],
    "canonicalization": {
      "algorithm": "RDFC-1.0",
      "serialization": "canonical-n-quads-utf8"
    },
    "digest": {
      "encoding": "lowercase-hex",
      "function": "SHA-256",
      "widthBits": 256
    },
    "iriTemplate": "urn:rev:content:{digest}",
    "recipeDigest": "sha256:042aa02a35bdc4c7357e38288144a2667afbc9bf1b465d1332e7694955dea4cb",
    "recipeFormat": "lattice-minting-recipe/1",
    "role": "ContentRevisionRole",
    "selfReference": "disallowed",
    "strategy": "ContentAddressedIdentity",
    "target": {
      "class": "https://example.org/lending#Contract",
      "deployment": null
    },
    "verifyFullDigest": true,
    "workBudget": 100000
  },
  "testSecrets": {},
  "positive": [
    {
      "id": "content-0",
      "category": "already-canonical",
      "inputs": {
        "canonicalNQuads": "<urn:order:1> <https://example.org/ns#status> \"paid\" <urn:g:orders/1> .\n",
        "canonicalizer": "declared by the vector generator"
      },
      "trace": [
        {
          "step": "digest",
          "function": "SHA-256",
          "hex": "314be7984dc3e13394ee6b2baf457fb3f940049f4359f43e1ec4a1edbb20ce12"
        },
        {
          "step": "truncate",
          "widthBits": 256,
          "hex": "314be7984dc3e13394ee6b2baf457fb3f940049f4359f43e1ec4a1edbb20ce12"
        },
        {
          "step": "encode",
          "encoding": "lowercase-hex",
          "value": "314be7984dc3e13394ee6b2baf457fb3f940049f4359f43e1ec4a1edbb20ce12"
        },
        {
          "step": "render",
          "iri": "urn:rev:content:314be7984dc3e13394ee6b2baf457fb3f940049f4359f43e1ec4a1edbb20ce12"
        }
      ],
      "iri": "urn:rev:content:314be7984dc3e13394ee6b2baf457fb3f940049f4359f43e1ec4a1edbb20ce12"
    },
    {
      "id": "content-1",
      "category": "already-canonical",
      "inputs": {
        "canonicalNQuads": "<urn:order:1> <https://example.org/ns#note> \"caf\u00e9 \ud83d\ude00\" .\n<urn:order:1> <https://example.org/ns#status> \"paid\" .\n",
        "canonicalizer": "declared by the vector generator"
      },
      "trace": [
        {
          "step": "digest",
          "function": "SHA-256",
          "hex": "b84f13d47ff72337a3d3e2c4601c2c6d8fbb93a465dc0df427b15e00c21a012d"
        },
        {
          "step": "truncate",
          "widthBits": 256,
          "hex": "b84f13d47ff72337a3d3e2c4601c2c6d8fbb93a465dc0df427b15e00c21a012d"
        },
        {
          "step": "encode",
          "encoding": "lowercase-hex",
          "value": "b84f13d47ff72337a3d3e2c4601c2c6d8fbb93a465dc0df427b15e00c21a012d"
        },
        {
          "step": "render",
          "iri": "urn:rev:content:b84f13d47ff72337a3d3e2c4601c2c6d8fbb93a465dc0df427b15e00c21a012d"
        }
      ],
      "iri": "urn:rev:content:b84f13d47ff72337a3d3e2c4601c2c6d8fbb93a465dc0df427b15e00c21a012d"
    }
  ],
  "negative": [
    {
      "id": "neg-no-canonicalizer",
      "category": "caller-obligation",
      "inputs": {
        "canonicalNQuads": "<urn:order:1> <https://example.org/ns#status> \"paid\" <urn:g:orders/1> .\n"
      },
      "error": "CanonicalizerNotDeclared"
    }
  ],
  "format": []
}
